title,selftext,subreddit,title_text,text_len
Question about using the Apple Watch with an iPhone I just leave at home,"Hey everyone. I’m getting a Samsung S20 FE from my carrier with a recent plan upgrade. As a former android user I’m excited to play around with this phone and use it as my daily driver for a few weeks, maybe longer. 

My question is this: I plan on still wearing my Apple Watch daily to track my morning home workouts and to use as my watch at work. I’d be leaving my iPhone at home while I use my S20 FE as my main phone with my SIM card in it. Will the Apple Watch still monitor and save my data like movement, calories, standing, steps, etc and then upload that to my iPhone when I get home 8-9 hours later? 

Just curious how that would work as I’d like to still track those metrics daily. Thank for the help!",1,question using apple watch iphone leave home hey everyone getting samsung fe carrier recent plan upgrade former android user excited play around phone use daily driver week maybe longer question plan still wearing apple watch daily track morning home workout use watch work leaving iphone home use fe main phone sim card apple watch still monitor save data like movement calorie standing step etc upload iphone get home hour later curious would work like still track metric daily thank help,490
Satisfaction, ,1,satisfaction,12
Is it crazy or anyone of you use two apple watches paired to a single iphone?,"I already own a series 6 Apple Watch in blue, my very first Apple Watch. I badly wanted to have Nike silver version also and switch between these paired to my iPhone. I guess this is addictive",1,crazy anyone use two apple watch paired single iphone already series apple watch blue first apple watch badly wanted nike silver version also switch paired iphone guess addictive,178
Which Apple Watch?,"Hey guys so I’m looking into getting a Apple Watch. I’ve never bought a smart watch or anything in this area. I’m quite active as working out 6 times a week, and trying to drink a gallon of water and day andddd trying to stay in a daily caloric deficit as I am cutting. Since this has went from a hobby so something a bit more serious and is kinda my main goal in life, building my body, and fitness, I was looking into getting a Apple Watch. But from all these options it’s making my head explode to be frank, if someone could help out that would be great ❤️

- Iby",1,apple watch hey guy looking getting apple watch never bought smart watch anything area quite active working time week trying drink gallon water day andddd trying stay daily caloric deficit cutting since went hobby something bit serious kinda main goal life building body fitness looking getting apple watch option making head explode frank someone could help would great iby,374
Does Nike Run Club work with the fitness rings and awards?,"So I've started to work out using my watch and I've found out about Run Club, which seems to be better than the default workout app for indoor and outdoor runs. I'm willing to give it a go, but I don't want to find out the runs I do using it don't count towards the awards system (may sound futile but it helps a lot motivating me).

I've heard it didn't work a few years ago, but is it still true?",1,nike run club work fitness ring award started work using watch found run club seems better default workout app indoor outdoor run willing give go want find run using count towards award system may sound futile help lot motivating heard work year ago still true,260
Calendar complication always says ‘No Events’,"I have tried everything to get the complication on my watch to show my calendar events, but have not had any luck. I have my Google calendar set as the default calendar on my iPhone, and have tried every setting on the watch app from mirroring my phone to only setting it to show one calendar. Any ideas?",1,calendar complication always say event tried everything get complication watch show calendar event luck google calendar set default calendar iphone tried every setting watch app mirroring phone setting show one calendar idea,224
based on true events., ,1,based true event,16
What to use for body weight workout?,"When trying to log a workout what should I select for a body weight workout?

Edit: thanks for the suggestions. I’ve never owned any type of wearable before. And just got an Apple Watch SE yesterday.",1,use body weight workout trying log workout select body weight workout edit thanks suggestion never owned type wearable got apple watch se yesterday,147
"Happy bday to Me and Steve. Btw thanks for founding Apple so I could get this s6 Steve, very cool:)", ,1,happy bday steve btw thanks founding apple could get steve cool,63
Bug? Says total is 2165kcal but only shows 5. I would have been active all day as I was at work plus 178kcal weights at home?, ,1,bug say total kcal show would active day work plus kcal weight home,67
Band collection, ,1,band collection,15
GPS vs CELLULAR,"Hi. Does anyone know if you can use music apps like Spotify without WiFi (on a walk outside) and does the health tracker still work without constant WIFI access?  I want to go on a walk and have my steps tracked, etc. but don’t want to pay extra for a cellular watch. Does anyone know? Thank you.",1,gps v cellular hi anyone know use music apps like spotify without wifi walk outside health tracker still work without constant wifi access want go walk step tracked etc want pay extra cellular watch anyone know thank,216
My Series 6's battery goes from 100% to 86% in just 4 hours. Is this normal for a S6 AW?,Oh and it's 4 hours of light use. Basically just on my wrist. Last week I was getting the battery down to 91% at this same timeframe. Dunno what changed between then.,1,series battery go hour normal aw oh hour light use basically wrist last week getting battery timeframe dunno changed,116
FINALLY got my hands on some Red and Blue connectors!, ,1,finally got hand red blue connector,35
Vodafone Roaming (UK Users),"Anybody managed to test the Vodafone roaming on an Apple Watch within Europe?

Obviously been difficult for the last 12 months...",1,vodafone roaming uk user anybody managed test vodafone roaming apple watch within europe obviously difficult last month,119
A couple weeks ago I added a workout in order to complete my move goal and it just added all these exercise minutes. Now I went back to try to fix it and it took away my stand minutes and my stand minutes from the day before even though they’re clearly showing up. WTHHHH, ,1,couple week ago added workout order complete move goal added exercise minute went back try fix took away stand minute stand minute day even though clearly showing wthhhh,169
"What gold Milanese should I pick? Left is new gold, right is old gold", ,1,gold milanese pick left new gold right old gold,47
"I think I might get an Apple Watch SE, space grey or silver?","

[View Poll](https://www.reddit.com/poll/lsaf3o)",1,think might get apple watch se space grey silver view poll,58
Spigen NEOFLEX screen protector destroyed the oleophobic coating on my wife's apple watch 5 40mm,"Hi all,

This seems like a very unusual problem but it is totally true. We had applied this soft screen protector on my wife's watch together with one of their cases. The case kept pushing against the edges of the protector which were starting to peel off. I removed the protector at the end and now the screen is all messed up. Part of it has the coating and part of it doesn't have anything on it.

Any ideas how this might be fixed? The watch was a present for Christmas so it is pretty new and she is quite sad now.

Any help is appreciated, Thank you!",1,spigen neoflex screen protector destroyed oleophobic coating wife apple watch mm hi seems like unusual problem totally true applied soft screen protector wife watch together one case case kept pushing edge protector starting peel removed protector end screen messed part coating part anything idea might fixed watch present christmas pretty new quite sad help appreciated thank,377
ANY APP RECOMENDATION FOR FAST DICTATED NOTES??,"Better if I can activate it with Siri or with one touch to the screen.
At this moment “Bear” is wining.",1,app recomendation fast dictated note better activate siri one touch screen moment bear wining,93
"my brand new apple watch se! got it yesterday, so excited :)", ,1,brand new apple watch se got yesterday excited,46
Best Apple Watch case + screen protector,Just got me my first Apple Watch. I got the SE and I’m trying to find a nice but also protective case and screen protector for it or like a cover. If anyone got any recommendations I would really appreciate it. Thank you.,1,best apple watch case screen protector got first apple watch got se trying find nice also protective case screen protector like cover anyone got recommendation would really appreciate thank,189
How does the GMT face work?,"I thought the red hand and the colored outer rings were supposed to indicate sunrise and sunset in the 24hr clock. And it seemed to be doing that until I changed the color and now I have no idea what the outer rings represent. I have it set to my time zone and everything.

https://i.imgur.com/0ugaUJo.jpg",1,gmt face work thought red hand colored outer ring supposed indicate sunrise sunset hr clock seemed changed color idea outer ring represent set time zone everything,163
Always on display,"When I start an activity in the exercise app on my Series 5, the always on display won’t return back to the main clock, instead it keeps the exercise app open until I finish my activity, is there any way to return to the main screen while having the exercise app on in the meantime?",1,always display start activity exercise app series always display return back main clock instead keep exercise app open finish activity way return main screen exercise app meantime,179
Just upgraded from Series 2 to Series 6. Did Apple Watch seriously get WORSE for people with tattoos?,"Have full sleeve tattoos, and been using my Series 2 for years with wrist detection and auto-pause workout both turned off. Yeah it sucks that I can't use apple pay, but whatever, it's been fine. 

Tried doing my first yoga workout on my series 6, and every time I stopped moving for more than five seconds it auto paused the workout. Both auto pause and wrist detection are turned off. Is there any fix for this on series 6?",1,upgraded series series apple watch seriously get worse people tattoo full sleeve tattoo using series year wrist detection auto pause workout turned yeah suck use apple pay whatever fine tried first yoga workout series every time stopped moving five second auto paused workout auto pause wrist detection turned fix series,320
Do you guys have trouble with Podcasts app?,"I know Apple is just supposed to take care of everything behind the scenes, and in part of that, they want to sync your podcasts overnight while it's on the charger. But when I wake up in the morning and get ready to go for a run, my most recent Podcast is from three days ago, and I've already heard it on my phone. I sit on the edge of the bed watching the little circle in the Watch app spin for 15 minutes while it thinks about transferring 100Mb of a show. 

Do you guys share this problem, or is it pretty seamless for you?",1,guy trouble podcasts app know apple supposed take care everything behind scene part want sync podcasts overnight charger wake morning get ready go run recent podcast three day ago already heard phone sit edge bed watching little circle watch app spin minute think transferring mb show guy share problem pretty seamless,318
"Most basic watch face, but still one of the best", ,1,basic watch face still one best,31
Apple Watch Possibilities with WorkSpace ONE,"Hi time lovers,

We've been requested to check what is feasible or not with an Apple Watch through the WS1 MDM.

As far as I could read on WS1 documentation, it seems that we can enforce passcodes / wrist detection but is there more to that ?

Have anybody experienced usage of an Apple Watch in an MDM and specifically WS1 ?

Thanks

Pickle",1,apple watch possibility workspace one hi time lover requested check feasible apple watch w mdm far could read w documentation seems enforce passcodes wrist detection anybody experienced usage apple watch mdm specifically w thanks pickle,236
does resetting fitness calibration data delete my existing activity ring records?,"So I got my brand new AWS6 back in Jan, worked well for me until a couple of weeks ago when it started having problems recording my activity minutes. I am working in retail so it's a lot of walking and I usually clock a 30mins brisk walk/run to the train station on my way home. But lately regardless of how much I walked and exercised, I can't seem to complete my activity rings (beside stand ring). 

usually a 30/40mins run will clock me at least 30ish minutes of workout, but it was registered as 2mins. I sometimes get too lazy to start a workout before running because previously it registers well, but now even if I clocked a 30mins outdoor walk, it'll be registered as 3mins exercise, (only reason I can find is that my heart rate chart isn't available but state that my avg heart rate is 106bpm) 

I tried re-pairing my watch, restarting, turning on and off the fitness and heart tracking, because I believe my heart rate tracking is partly involved. so I’m wondering if a reset of fitness calibration data helps? and will it delete my previous activity ring records? 


tldr: move and exercise ring not closing despite moving a lot at work, workouts are not helping because heart rate chart isn't available despite wearing my watch tightly. wondering if resetting fitness calibration data helps? and would it delete my existing activity ring records? 

greatly appreciate any form of help and response! 🤗",1,resetting fitness calibration data delete existing activity ring record got brand new aws back jan worked well couple week ago started problem recording activity minute working retail lot walking usually clock min brisk walk run train station way home lately regardless much walked exercised seem complete activity ring beside stand ring usually min run clock least ish minute workout registered min sometimes get lazy start workout running previously register well even clocked min outdoor walk registered min exercise reason find heart rate chart available state avg heart rate bpm tried pairing watch restarting turning fitness heart tracking believe heart rate tracking partly involved wondering reset fitness calibration data help delete previous activity ring record tldr move exercise ring closing despite moving lot work workout helping heart rate chart available despite wearing watch tightly wondering resetting fitness calibration data help would delete existing activity ring record greatly appreciate form help response,1032
Gold Series 5 or Stainless Steel series 5 ?,"Still rocking my series Zero est. 2015
https://i.imgur.com/FCzGTCW.jpg
Bought on release day. 

Should I buy a series 5 Stainless Steel steel 44mm to use with my same band ? 

Or a 

Series 5 gold to use with my band ? 

Or a

Titanium one ?

Leaning towards SS silver . 


(Please don’t recommend series 6 I want series 5 series 6 is pretty much the same thing and series 5 are way cheaper now )",1,gold series stainless steel series still rocking series zero est bought release day buy series stainless steel steel mm use band series gold use band titanium one leaning towards s silver please recommend series want series series pretty much thing series way cheaper,267
Bug with Series 3 Modular clock?,"Hi guys I have a small problem, i just got a series 3 the other day and i'm loving it but there is one small problem, on the modular watchface the top right time is raised up by a few mm compared to the top left complication and its not lined up properly, when i look in the iwatch app at the face on my phone it looks fine but when i send it over its raised, its a small thing but its really triggering my ocd lol. Does anyone know why it could be happening, i've even done a factory reset but no luck, thanks for any help and sry if i posted this wrong.

&amp;#x200B;

edit: watch app

https://preview.redd.it/gp2xzboormj61.png?width=272&amp;format=png&amp;auto=webp&amp;s=81b0a9acae57f8e1450af2c492acda71c657c8cc",1,bug series modular clock hi guy small problem got series day loving one small problem modular watchface top right time raised mm compared top left complication lined properly look iwatch app face phone look fine send raised small thing really triggering ocd lol anyone know could happening even done factory reset luck thanks help sry posted wrong amp x b edit watch app,370
Just got an Nike sport loop for my se loving it so far, ,1,got nike sport loop se loving far,33
Bought an AW only for 15 days and got an award for January?, ,1,bought aw day got award january,31
Why are watch faces off center?,"For example, the modular compact is almost touching the top frame and there’s so much space on the bottom. What is the logic?",1,watch face center example modular compact almost touching top frame much space bottom logic,91
Difference In Finishes,"I know you can choose from Aluminum, Stainless Steel, and now Titanium, but does this affect the back part of the watch that goes against your skin too, or are all watches the same on the back?  I get a real nasty, itchy and scaly rash from mine so I am wondering if a different finish will alleviate this at all.",1,difference finish know choose aluminum stainless steel titanium affect back part watch go skin watch back get real nasty itchy scaly rash mine wondering different finish alleviate,179
Stream activity data to iPhone,"Is there an app available which is streaming workout data live such as heart rate, distance etc from activity app on Apple Watch to the iPhone?",1,stream activity data iphone app available streaming workout data live heart rate distance etc activity app apple watch iphone,125
Any suggestions for a good heart rate app?,"Something I’m really interested in tracking is the zones my heart rate is in while working out. Like how many minutes I was in the fat burn zone or cardio zone. 

I switched over from the Fitbit and that was one of my favorite things to track.",1,suggestion good heart rate app something really interested tracking zone heart rate working like many minute fat burn zone cardio zone switched fitbit one favorite thing track,175
My solution to Sport Band being either too loose or too tight,"I bought my first Apple Watch few days ago and I struggled to find prefect fit with my Sport Band wearing S/M size. 4th hole was too loose and 3rd too tight, so I tried M/L size, and it turned out that it's 1st hole is perfect for me. So if your arm is not tiny or super big and you struggle to find perfect fit with one band, try the other size, their sizes overlap, but are not identical.",1,solution sport band either loose tight bought first apple watch day ago struggled find prefect fit sport band wearing size th hole loose rd tight tried l size turned st hole perfect arm tiny super big struggle find perfect fit one band try size size overlap identical,267
"170 mm wrist , hell confused between 50mm vs 44 mm . Pic is 40 mm .Opinions pls .", ,1,mm wrist hell confused mm v mm pic mm opinion pls,49
New Apple Watch! So excited!, ,1,new apple watch excited,23
"After Months of ownership, I’m still in love with my Series 6  Watch (44mm Deep-Blue). How has ownership been for you guys?", ,1,month ownership still love series watch mm deep blue ownership guy,66
Heart rate peloton issue,"I’m hoping someone can help me with this tech issue. I use peloton digital app for workouts and within the last days my heart rate is not tracking every time I start a workout. The “heart” just keeps spinning and never identifies my heart rate. If I do a workout tracked with my Apple Watch the heart rate works just fine.
I made sure my watch is updated and the app is connected to my watch. Restarted my phone. Nothings changed.

Anyone else have this same issue? I love to track my heart rate during the workouts to get more accurate calorie burn and also my level of exertion.
Thanks!!",1,heart rate peloton issue hoping someone help tech issue use peloton digital app workout within last day heart rate tracking every time start workout heart keep spinning never identifies heart rate workout tracked apple watch heart rate work fine made sure watch updated app connected watch restarted phone nothing changed anyone else issue love track heart rate workout get accurate calorie burn also level exertion thanks,422
"Does anyone know why, when dimmed my watch looks like this? It doesn’t do it when raised and lit up...", ,1,anyone know dimmed watch look like raised lit,45
[Support] Siri on Apple Watch keeps saying “I didn’t find &lt;artist name&gt; on Apple Music”,"iPhone 11, Apple Watch S6, both updated to the latest firmwares. When I drive I have my phone paired to the radio via Bluetooth and I usually use Siri on my watch to control the music. The past couple of days I’ve been getting the message that it can’t find whatever artist or song I tell it to play. I’ve got an active Apple Music account and it works fine if I use Siri on my phone or if I use the phone music app or even if I use the music app on the watch to manually search for a song. This has always worked fine for me in the past, I don’t have any idea why it stopped all of the sudden. Anybody got any ideas on what I can try to get it to work again?",1,support siri apple watch keep saying find lt artist name gt apple music iphone apple watch updated latest firmware drive phone paired radio via bluetooth usually use siri watch control music past couple day getting message find whatever artist song tell play got active apple music account work fine use siri phone use phone music app even use music app watch manually search song always worked fine past idea stopped sudden anybody got idea try get work,454
SE stopped recording time asleep after 3 days owning it,"https://imgur.com/gallery/Uas046B

I’ve tried resetting the schedule and reset the Apple Watch from factory not backup and still can’t get it to work


Any ideas?",1,se stopped recording time asleep day owning tried resetting schedule reset apple watch factory backup still get work idea,121
S3 to SE. Still waiting on my Spigen..., ,1,se still waiting spigen,23
Sometimes you need a pop of color!, ,1,sometimes need pop color,24
"I fell asleep on my watch and must’ve turned on a workout last night so, yea.", ,1,fell asleep watch must turned workout last night yea,52
"Finally, it’s here!", ,1,finally,7
Wrong workout option,"Does anyone know if it matters if you accidentally press the wrong workout option for your workout? Also, is there a way to edit the workout option after the workout? 

I think the calories came out to be the same, I just wanted to make sure something like choosing HIIT when actually going for a walk screws something up or skews heart rate/calories!",1,wrong workout option anyone know matter accidentally press wrong workout option workout also way edit workout option workout think calorie came wanted make sure something like choosing hiit actually going walk screw something skews heart rate calorie,250
VO2 calculation,"I recently updated my Apple Watch and it now gives a VO2 estimate.  
The calculation is uses is Vo2max = 15x max heart rate ÷ resting heart rate (measured while exercising).  
From my limited knowledge of health, it seems that a heathy heart results in a \*lower\* max heart rate while exercising.  
But that would seem to \*lower\* the VO2 max using this calculation?  
I'm looking to increase my VO2 max. I have a good, low resting heart rate, and likewise a reasonably low max heart rate whilst walking vigorously. But that gives me a low VO2 measurement.  
Any advice appreciated",1,vo calculation recently updated apple watch give vo estimate calculation us vo max x max heart rate resting heart rate measured exercising limited knowledge health seems heathy heart result lower max heart rate exercising would seem lower vo max using calculation looking increase vo max good low resting heart rate likewise reasonably low max heart rate whilst walking vigorously give low vo measurement advice appreciated,423
Can't restore new S6 from backup because the backup is 7.3.1.... help?,"I unpaired my S5, which created a backup that says it's in 7.3.1.

When I try to initiate my new S6 from a backup, that latest backup doesn't appear as an option (even though I can see that it's present on the iPhone).

I know that the problem is supposed to be that you have to set it up as a new watch first and update the software.  But I can't update it past 7.3 because it's S6.

Do we know a workaround?

And if not, will I lose anything significant by setting it up as new, such as overwriting all my Activity logs etc?

&amp;#x200B;

Thank you.",1,restore new backup backup help unpaired created backup say try initiate new backup latest backup appear option even though see present iphone know problem supposed set new watch first update software update past know workaround lose anything significant setting new overwriting activity log etc amp x b thank,308
Apple watch now unlocks your iphone 📱 when you are waring a mask 😷. This is awesome!!!, ,1,apple watch unlocks iphone waring mask awesome,46
Underside of watch getting damaged, ,1,underside watch getting damaged,31
❤️ Solo Loop (Plum), ,1,solo loop plum,14
