title,selftext,subreddit,title_text,text_len
Annoying isn't it, ,1,annoying,8
I think I might have a problem, ,1,think might problem,19
california poppy vibes, ,1,california poppy vibe,21
Wanted to make something nice to brighten up my day, ,1,wanted make something nice brighten day,39
One of my favorite small things about having an Apple Watch is setting a shortcut automation to change the watch face automatically from my work watch face to casual!, ,1,one favorite small thing apple watch setting shortcut automation change watch face automatically work watch face casual,119
Finally did my first running workout after having an Apple Watch since launch day in 2015 😅, ,1,finally first running workout apple watch since launch day,58
"Had a doctors appointment at 10, can you tell?😂", ,1,doctor appointment tell,23
"Did you know you can flip your watch? My new to me series 4, with the crown/button on the left.", ,1,know flip watch new series crown button left,44
What is everyones thoughts on the Night Sky app? I think it's a cool feature, ,1,everyones thought night sky app think cool feature,50
"Just joined the club. I’d planned to get the 40mm SE and people here talked me into the 44mm 6, and now I have pledged myself in service to the colored rings. Witness Me!!", ,1,joined club planned get mm se people talked mm pledged service colored ring witness,83
Closed my rings for the first time. 17 miles in 2 days, ,1,closed ring first time mile day,31
Last time I had an watch was a series 3. Upgraded to a Apple Watch SE 44mm., ,1,last time watch series upgraded apple watch se mm,49
New Apple Watch band courtesy of Rhino Brand! Loving it so far!, ,1,new apple watch band courtesy rhino brand loving far,52
Bathroom mount for S5 with leather link, ,1,bathroom mount leather link,27
Head’s up if you are buying cheap bands., ,1,head buying cheap band,22
Apple Watch Series 6: 40mm Gold Aluminum w/Gold Milanese Loop, ,1,apple watch series mm gold aluminum w gold milanese loop,56
My cheap band+case setup on AW6. Perfect for my work, ,1,cheap band case setup aw perfect work,37
My Simple App Layout, ,1,simple app layout,17
Any hacks for car Bluetooth?,"Hello, I am curious if anyone has figured out a workaround to get Apple Watch audio over car Bluetooth? My Apple Watch is able to connect to non-Apple branded portable speakers and such to play Spotify, but not my car. This is when I am using my watch without a phone nearby or connected even.

Is there perhaps a Bluetooth USB receiver that may allow this in my car (which has usb audio ports)?

Thanks!",1,hack car bluetooth hello curious anyone figured workaround get apple watch audio car bluetooth apple watch able connect non apple branded portable speaker play spotify car using watch without phone nearby connected even perhaps bluetooth usb receiver may allow car usb audio port thanks,286
Stand goal got me floored - in one hour I climbed up and down a flight of stairs to do laundry and batched egg salad (including peeling eggs). It looks like it took this as exercise but not standing? My older version would count it as standing if I rode my bike for an hour..., ,1,stand goal got floored one hour climbed flight stair laundry batched egg salad including peeling egg look like took exercise standing older version would count standing rode bike hour,183
Oysterflex Facsimile(?),"Not sure if this’s really something that would fall under the grounds of this sub or if anybody has experiences with what’s kinda an odd request but here goes...

Does anybody know of a good/high quality copy of [Rolex’s Oysterflex](https://i.imgur.com/LE7dPKy.jpg) rubber strap that works for an Apple Watch? From the couple I’ve tried on etc. they’re just very comfortable for me and I’d love to have that comfort with my day to day watch! I know Apple has their own silicon straps and I know I can buy knockoffs of the Rolex ones but they’re made to fit Rolex’s lugs and won’t even take an Apple Watch spring bar adapter. This’s been my workaround in the past for putting non-Apple Watch straps on mine but I don’t think it’ll work in this case. 

Love to hear if anybody has any suggestions even if it’s not entirely on the mark, I’m definitely open to other options — ideally available in some fun colors! Thanks.",1,oysterflex facsimile sure really something would fall ground sub anybody experience kinda odd request go anybody know good high quality copy rolex oysterflex rubber strap work apple watch couple tried etc comfortable love comfort day day watch know apple silicon strap know buy knockoff rolex one made fit rolex lug even take apple watch spring bar adapter workaround past putting non apple watch strap mine think work case love hear anybody suggestion even entirely mark definitely open option ideally available fun color thanks,529
Apple Watch SE Nike Edition - loving it!,Just bought this. I had the original Apple Watch. Obviously this is worlds better. What apps or watch bands do you guys recommend?,1,apple watch se nike edition loving bought original apple watch obviously world better apps watch band guy recommend,115
Read receipts with Apple Watch,"So I have read receipts on for certain people on my phone and all read receipts are turned off on my Apple Watch, but it’s still sending the read receipt when I open the message on my Apple Watch. Does this only happen when you have read receipts turned on for specific contacts? Or does it always send read receipts when you open the message on the watch even if they’re turned off for just the Apple Watch? I like having read receipts on, but I can’t always respond right away when I open it on my watch. Thanks!",1,read receipt apple watch read receipt certain people phone read receipt turned apple watch still sending read receipt open message apple watch happen read receipt turned specific contact always send read receipt open message watch even turned apple watch like read receipt always respond right away open watch thanks,316
Is this an original Apple watch charger?Just bought a new AW6 from someone and it came with this but I don't see any Apple writing/logo on it., ,1,original apple watch charger bought new aw someone came see apple writing logo,78
Siri Watch Face,"Hi all! So I’ve been trying out the Siri watch face and so far it’s only been showing me the same 2-3 data sources at all times (heart rate, activity, weather, and occasionally the news). I have a bunch of other data sources turned on, but they NEVER show up. My phone is all connected and everything too. 

Does anyone have any advice? I really love the idea of this watch face but I’m bummed It never seems to adapt or change. 

Thanks in advance!",1,siri watch face hi trying siri watch face far showing data source time heart rate activity weather occasionally news bunch data source turned never show phone connected everything anyone advice really love idea watch face bummed never seems adapt change thanks advance,268
Apple Watch vs other fitness trackers (and a couple other questions),"Hello, I’m about to begin getting serious with working out, and I’m in the market for a fitness tracker to monitor things including, but not limited to; heart rate, heart rate irregularities, steps, and distance traveled. Now I know these features can be found on much cheaper smart watches and fitness trackers, but my primary concern is ensuring that my readings are as accurate as possible. I know the Apple Watch would be one of the best options for this, but I just don’t really need the bells and whistles of WatchOS. Is there any tracker in particular that might be able to compete price and accuracy-wise, even if it winds up being a bit stripped of functions? Furthermore, assuming I was to purchase an Apple Watch, what significant differences are there comparing the series 3 to the SE and 6 that would justify the $100+ price bump?",1,apple watch v fitness tracker couple question hello begin getting serious working market fitness tracker monitor thing including limited heart rate heart rate irregularity step distance traveled know feature found much cheaper smart watch fitness tracker primary concern ensuring reading accurate possible know apple watch would one best option really need bell whistle watchos tracker particular might able compete price accuracy wise even wind bit stripped function furthermore assuming purchase apple watch significant difference comparing series se would justify price bump,577
New game: Spot to moment my soul mate broke up with me out of the blue., ,1,new game spot moment soul mate broke blue,41
Watch won’t connect to cellular,"Looking for advice: I have a current generation Apple Watch with cellular and a cell plan. When I am outside working in the garden, I cannot get it to play music from the cloud. It says there is no Internet connection. If I turn off wi fi in control center to try to force cellular, it just turns wi fi back on! Cellular icon in control center stays white, but watch settings show T Mobile. What am I doing wrong?",1,watch connect cellular looking advice current generation apple watch cellular cell plan outside working garden cannot get play music cloud say internet connection turn wi fi control center try force cellular turn wi fi back cellular icon control center stay white watch setting show mobile wrong,295
Would the calories burned on an elliptical be “active calories” or total?,"I have a daily workout and the machine (which I’m assuming is more accurate since it can calculate work done) always reads higher. Is the watch equivalent Total Cals, or Active Cals (off by a lot)?",1,would calorie burned elliptical active calorie total daily workout machine assuming accurate since calculate work done always read higher watch equivalent total cals active cals lot,181
WatchOS 7.3.2 Battery Drain?,I downloaded the new watchOS update (7.3.2) and my watch was completely dead this morning. Went to bed  with about 75% battery and the watch goes on sleep mode at 10pm so not sure if this is a bug with the new update. Anyone else experience the same problem?,1,watchos battery drain downloaded new watchos update watch completely dead morning went bed battery watch go sleep mode pm sure bug new update anyone else experience problem,172
"Wow, thanks app called motivation!", ,1,wow thanks app called motivation,32
SE vs 6 vs stick to my mechanicals,"I’ve been very much against the Apple Watch, as I’m more of a mechanical watch man - though, with the pandemic and not going out as much, my Omegas haven’t been worn too much.

Moved back to iPhone (I often switch between Android and iPhone), and already owning an iMac, iPad Pro and now a MacBook Air M1, I’m considering the AW.

Trying you figure out whether an Apple Watch would be worth it for me, to work alongside my traditional watches. Fitness I’m not too bothered about but I imagine it’s useful to monitor. Apple Pay, glancing at messages etc I like the idea of. Otherwise not sure what else it can be used for (other than the time).",1,se v v stick mechanicals much apple watch mechanical watch man though pandemic going much omega worn much moved back iphone often switch android iphone already owning imac ipad pro macbook air considering aw trying figure whether apple watch would worth work alongside traditional watch fitness bothered imagine useful monitor apple pay glancing message etc like idea otherwise sure else used time,397
Rings didn’t move after workout,"I completed a nearly 1 hour walk, which is seen in my fitness app, but I didn’t receive and movement on my move or exercise rings. This is the first time it’s happened, so I believe all the settings are calibrations are right. How can I get credit for my walk?",1,ring move workout completed nearly hour walk seen fitness app receive movement move exercise ring first time happened believe setting calibration right get credit walk,167
So close.., ,1,close,5
Was told over the phone this would cost more to replace than to just buy a new watch. Is that right??, ,1,told phone would cost replace buy new watch right,49
Sport Loop,"Hello everyone, I bought my first AW (a 44mm SE) a couple of months ago and I bought a Grey Sport Loop besides the Black Sport Band that comes with the watch. 

I have used the Sport Loop TWICE! My fear is that the velcro will get old quickly and lose it’s “stickiness”... What do you guys think? Have you used a Loop band for a long time? How do they stand a lot of use over time?

Thank you in advance!",1,sport loop hello everyone bought first aw mm se couple month ago bought grey sport loop besides black sport band come watch used sport loop twice fear velcro get old quickly lose stickiness guy think used loop band long time stand lot use time thank advance,257
Old Car with no Navigation. No problem. Apple Watch SE + AirPods Pro, ,1,old car navigation problem apple watch se airpods pro,53
They said I should set achievable goals... Thanks apple., ,1,said set achievable goal thanks apple,37
My previous watch is at the bottom of a Puerto Rican beach. Finally pulled the trigger on a Nike version and no regrets!, ,1,previous watch bottom puerto rican beach finally pulled trigger nike version regret,83
What Apple Watch models allow you to access apps that require WiFi while far from your phone?,The main idea is if I have a activity tracking smart watch I’d like to be able to leave my phone at home and only run with the watch. That way I can connect to ear buds and not lug a heavy phone around. What models allow this feature?,1,apple watch model allow access apps require wifi far phone main idea activity tracking smart watch like able leave phone home run watch way connect ear bud lug heavy phone around model allow feature,198
SERIES 3 Not Changing or showing music being played on phone,"When I play music on my iPhone, it doesn’t show on my series 3 (updated and unpaired/repaired). The now playing” app doesn’t show anything. 

Has anyone also been having this issue and does anyone have a fix ?",1,series changing showing music played phone play music iphone show series updated unpaired repaired playing app show anything anyone also issue anyone fix,153
Question,"Hi all,

I just got the Apple Watch Series 6 at AT&amp;T just now. They informed me that there is a Buy One Get One deal. I wanted to get an extra one, but the only thing that is stopping me is the only Apple Watches available are the GPS+Cellular version, and the person I am intending to give the extra one for doesn't have AT&amp;T. I was wondering if I could just get the watch and they would just not activate the cellular part - is that possible? They'll just be using the GPS version (one where they'll only be able to text + call if their phone is nearby.)",1,question hi got apple watch series amp informed buy one get one deal wanted get extra one thing stopping apple watch available gps cellular version person intending give extra one amp wondering could get watch would activate cellular part possible using gps version one able text call phone nearby,297
Found some interesting watch faces online but unsure about downloading them.,"If found a website (Applewatchfaces.io) that has a ton of free watch faces.  When I clicked on the download option, I assumed it would take me to the App Store to download their app. Instead, it attempted to download the watch face directly to the watch app. I didn’t allow it for obvious reasons. Have any of you ever attempted to use this service? I would like to know if it is a safe service and not something sinister. I’ve searched online but cannot find anything about the site. Thank you in advance!",1,found interesting watch face online unsure downloading found website applewatchfaces io ton free watch face clicked download option assumed would take app store download app instead attempted download watch face directly watch app allow obvious reason ever attempted use service would like know safe service something sinister searched online cannot find anything site thank advance,382
Issues Updating and pairing,I have an apple watch series 3 and it wont pair to my phone... I have paired it with past phones but for what ever reason it won't pair to my my current phone! I get to the part where it says it has an update then when I try to update it says I am not connected to the internet! I am connected! I am beyond frustrated and my husband isn't any help either! Can someone help me or point me in the right direction! Thank you!,1,issue updating pairing apple watch series wont pair phone paired past phone ever reason pair current phone get part say update try update say connected internet connected beyond frustrated husband help either someone help point right direction thank,249
Daughter rockin' a BLACKPINK watch face she created!, ,1,daughter rockin blackpink watch face created,44
Are the batteries in S0 and S2 38mm same?,"Hi everyone, I need to replace the battery in my gf's S0 38mm. I found the battery, but it says it's for a S2 38mm. Are the batteries the same? Thanks",1,battery mm hi everyone need replace battery gf mm found battery say mm battery thanks,85
Why does the calendar app only show the current month?,"I know there are some third party calendar apps that let you see 3 months but only current and future months, not previous.  Why is this? I can’t imagine it would take up much storage or processing power.",1,calendar app show current month know third party calendar apps let see month current future month previous imagine would take much storage processing power,155
What black strap you recommend,What the nicest black strap you guys have found for your six I don’t like the white standard strap doesn’t have a buckle any amazon U.K. links be great.,1,black strap recommend nicest black strap guy found six like white standard strap buckle amazon u k link great,109
Notification Issue,"Hello!

I just got an Apple Watch, and I'm having issues receiving notifications. They go directly to the notification drop down without ever vibrating or dinging. I've messed with the haptic and sound settings, and have that on loud and persistent, but when someone texts me it just silently delivers for no reason. I've looked at messages settings as well, and everything is sent for notifying me. Is there anything I can do about this? I've tried it with messages closed on my phone and my phone locked but that doesn't change anything. Would love some feedback! 

(also do not disturb and bedtime mode is off, so that shouldn't be a thing messing with it)",1,notification issue hello got apple watch issue receiving notification go directly notification drop without ever vibrating dinging messed haptic sound setting loud persistent someone text silently delivers reason looked message setting well everything sent notifying anything tried message closed phone phone locked change anything would love feedback also disturb bedtime mode thing messing,391
It was a long journey from China to Canada but my very first AW (S6 44mm) finally arrived on Tuesday. Love it so far and reading the manual front to back., ,1,long journey china canada first aw mm finally arrived tuesday love far reading manual front back,96
Activity goal,"Hi, I‘m curious what is your activity goal.

  
When I was setting up my first Watch I was suggested with sth around 520kcal. I bumped it up to 600 and I’m not closing this ring everyday now, but feel bad about lowering this number. 

&amp;#x200B;

Also, do you take monthly recommendation on activity goal?",1,activity goal hi curious activity goal setting first watch suggested sth around kcal bumped closing ring everyday feel bad lowering number amp x b also take monthly recommendation activity goal,193
Gen 1 vs newer calorie tracking,"I have the first generation of Apple Watch. It still holds battery and works very well, no complaints!
A friend and I just started sharing activity and her calories burned are consistently double mine even if we have the same amount of steps and exercise logged. Alternatively, on a day where we both wear our watches all day but do nothing but sit around the apartment I’ll log 40 calories and she’ll log 130.

Is there anything that says the calorie tracking is more accurate or different on newer watches? In the end I’m not worried about it, just going to keep meeting my personal goals... but I’m so curious!",1,gen v newer calorie tracking first generation apple watch still hold battery work well complaint friend started sharing activity calorie burned consistently double mine even amount step exercise logged alternatively day wear watch day nothing sit around apartment log calorie log anything say calorie tracking accurate different newer watch end worried going keep meeting personal goal curious,393
"Calories discrepancy between Apple Watch Activity, Health and Adidas Training app","Hi there,

So I did a workout using the Adidas Training app as usual, and by the end of it it says that I burned 200 active calories (the workout appears in the Activity app)...  but the Calories ring don't show that value,.

The Calories ring seems to get the data from Active Energy in the Health app, and the calories burned in the period of time that the Workout took place are different (120kcal...) 

I'm so confused right now, what is the point of doing the workout through Adidas App if the calories count is all over the place? Am i doing anything wrong?


Sorry for my english and thanks in advance for your help.",1,calorie discrepancy apple watch activity health adidas training app hi workout using adidas training app usual end say burned active calorie workout appears activity app calorie ring show value calorie ring seems get data active energy health app calorie burned period time workout took place different kcal confused right point workout adidas app calorie count place anything wrong sorry english thanks advance help,416
Nike+ running,"I’m having issues syncing my runs on the Nike run club app on my watch to my Nike run club app on my phone WHILE the run is going on.
My watch detects that I’ve started a workout on my phone but doesn’t measure distance and pace as I’m running and a workout doesn’t get added to my activity app once I’m done. 
However it works just fine when I start it directly from my watch instead of my phone.

Anyone is having a similar issue here?",1,nike running issue syncing run nike run club app watch nike run club app phone run going watch detects started workout phone measure distance pace running workout get added activity app done however work fine start directly watch instead phone anyone similar issue,264
What to look for when buying an apple watch?,"I’m looking for a used apple watch series 5, and I found a seller who is claiming that the screen doesn’t have any scratches, and that the battery’s health is 99%. I’m supposed to meet him tomorrow, so how do I ensure that this watch hasn’t been really used before, and then the person ended up changing the battery for the watch, and maybe the screen too before selling it?
Thanks in advance",1,look buying apple watch looking used apple watch series found seller claiming screen scratch battery health supposed meet tomorrow ensure watch really used person ended changing battery watch maybe screen selling thanks advance,227
Rocking the all white today👍🏼⌚️, ,1,rocking white today,19
watchOS 7.3.2 security update with WebKit fix drops for Apple Watch, ,1,watchos security update webkit fix drop apple watch,51
Issue with heart rate measurement at the start of running workout, ,1,issue heart rate measurement start running workout,50
The dollar store near my house are selling selling “ The Apple Watch Series six and the AirPods Pro for $40 do you guys want me to buy both of them and see how crappy they are?, ,1,dollar store near house selling selling apple watch series six airpods pro guy want buy see crappy,98
No longer receiving calls apple watch (s4),"As per title, no longer receiving calls on apple watch 4. All other notifications work fine. Have checked settings and have it to mirror iPhone (11).  Can make calls from watch though

Only way to fix is to reboot both phone and watch but after some time the problem will reoccur. 

Any ideas how to fix?",1,longer receiving call apple watch per title longer receiving call apple watch notification work fine checked setting mirror iphone make call watch though way fix reboot phone watch time problem reoccur idea fix,210
I do have a feeling that GPS on Apple Watch is not accurate.,"I jog 3 times in a week and I recently switched from my Garmin watch to Apple Watch. The 5KM route which I run regularly was recorded as 5.25KM. 

I understand nothing can be 100% accurate but an error of 5% seems to be not fair from tech giant like Apple. 

My Garmin watch cannot be wrong because I ran a half marathon with it and it was 99.9% accurate.

Anyone faced similar problem with Apple Watch? Any thoughts?",1,feeling gps apple watch accurate jog time week recently switched garmin watch apple watch km route run regularly recorded km understand nothing accurate error seems fair tech giant like apple garmin watch cannot wrong ran half marathon accurate anyone faced similar problem apple watch thought,293
Copped this black classic buckle 42mm for my S4 watch. Apple really needs to bring these back someday, ,1,copped black classic buckle mm watch apple really need bring back someday,73
What other apps besides Apple Mail support Handoff on Apple Watch? I had no idea of this feature. Seems very useful., ,1,apps besides apple mail support handoff apple watch idea feature seems useful,77
