title,selftext,subreddit,title_text,text_len
Will US version Watch3 work in Canada?,"The Watch3 is currently on sale in the USA ($ 150 off).  Even adding taxes and customs clearance fees, it is still much cheaper than the Canadian model.


45mm Black Bluetooth - Shipping Qc, Canada
Amazon USA: 458 $ Cad (tax, shipping and customs)
Amazon Canada: 608 $ Cad (tax and free shipping)

Is it going to work properly?  
a) Updates 
b) functions (Google Pay (Visa, MasterCard), bluetooth connection) 
c) US functions (ECG, blood oxygen, bp etc). 

Is it a good idea to order from the United States or will I have compatibility problems outside the US territory?

Thanks",0,u version watch work canada watch currently sale usa even adding tax custom clearance fee still much cheaper canadian model mm black bluetooth shipping qc canada amazon usa cad tax shipping custom amazon canada cad tax free shipping going work properly update b function google pay visa mastercard bluetooth connection c u function ecg blood oxygen bp etc good idea order united state compatibility problem outside u territory thanks,433
Is there a way to have alexa turn on do not disturb on a Galaxy watch active 2?,"I currently have a routine on Alexa that activates when I say ""Alexa good night."" Can I add to that routine something that activates DND on the active watch 2?",0,way alexa turn disturb galaxy watch active currently routine alexa activates say alexa good night add routine something activates dnd active watch,146
Is my battery life normal galaxy active 2,"After fully charging it a few hours ago my battery life is now at 45% is this normal or should I be worried

Update: I've had the watch on for around 15 hours now, 8% battery life",0,battery life normal galaxy active fully charging hour ago battery life normal worried update watch around hour battery life,123
OG Galaxy watch BP?,"Now that tizen 5 has been released for the OG galaxy watch, is there a way to get BP working on both Samsung and non Samsung phones?

Thanks",0,og galaxy watch bp tizen released og galaxy watch way get bp working samsung non samsung phone thanks,101
The last thing I would expect from a Samsung health notification., ,0,last thing would expect samsung health notification,51
"Original GW vs GW3, upgrade option.","I have BP working, just want to know what I'm missing in GW3 like ECG or oxygen? I mean are they worthy? Samsung Pay not working here.

[View Poll](https://www.reddit.com/poll/lt9880)",0,original gw v gw upgrade option bp working want know missing gw like ecg oxygen mean worthy samsung pay working view poll,121
Things I would like to know before purchasing my 2nd Smart Watch the GW3,"Hello,

I hope some people can help me out if you have 2 or more Smart watches for other occasions, I currently using the galaxy fit for my main workouts 5x times a week weightlifting and 2x boxing a week for monitoring my HR with everyday walking and sleep tracking. 

I'm wondering if I get the GW3 how it records my sleep and workouts when I use the Galaxy fit, Does it register only on the watch I wear? 

So for example I use my fit to workout to record my Heartrate, does those results also will be visible on my 2nd new GW3. This also relates to my sleeping time if I sleep with my fit does it shows up at my GW3 zero hours slept? And how about stepcount using 2 watches? 

I think it will be recorded as a overall in Samsung health but would love to see this info also on my galaxy Watch 3 as a complete during the day when I'm outside with the GW3.

Thanks in Advance!",0,thing would like know purchasing nd smart watch gw hello hope people help smart watch occasion currently using galaxy fit main workout x time week weightlifting x boxing week monitoring hr everyday walking sleep tracking wondering get gw record sleep workout use galaxy fit register watch wear example use fit workout record heartrate result also visible nd new gw also relates sleeping time sleep fit show gw zero hour slept stepcount using watch think recorded overall samsung health would love see info also galaxy watch complete day outside gw thanks advance,562
Tracking exercise,"I use a shortcut on my Galaxy Watch to record my walks, but can I use it to track exercises that aren't available on it?

Skipping/jump rope isn't available to select on the Galaxy Watch but it is available in Samsung Health on my phone. Would I have to have my phone in my pocket for it to work or would my watch detect it?",0,tracking exercise use shortcut galaxy watch record walk use track exercise available skipping jump rope available select galaxy watch available samsung health phone would phone pocket work would watch detect,207
I need a watch face for sneaking peeks. Is there one?,"Or can you make one? 
What I mean is basically have the design of the face be that I can have my watch face barely peeking out of my sleeve, but the time is indicated on the right side, so I can read it without having to pull up my sleeve all the way. 

Use case example: I'm doing dishes. I can't pull up my sleeves. My hands are soapy and wet. But I pull up my arm to check the time. I'm wearing long sleeves. So only. 1/4 of the right edge of my watch is revealed. How I wish I could still know the time....",0,need watch face sneaking peek one make one mean basically design face watch face barely peeking sleeve time indicated right side read without pull sleeve way use case example dish pull sleeve hand soapy wet pull arm check time wearing long sleeve right edge watch revealed wish could still know time,299
Wierd problem with the Store,"I am having a wierd problem with the watch face store. I have some free vouchers for some faces that I want to claim. I click Accept and Download, and the voucher, but then when I click buy, it loads infinitely and never actually downloads.

Any ideas?",0,wierd problem store wierd problem watch face store free voucher face want claim click accept download voucher click buy load infinitely never actually downloads idea,165
GW new stock watchfaces ready in the samsung Galaxy store, ,0,gw new stock watchfaces ready samsung galaxy store,50
How to make best use of my Samsung Galaxy Watch Original.,"I am currently using Samsung s20 FE, Galaxy Watxh Original, Earbuds Plus and usually do a lot of Customisation on my phone, but I have not found any proper way to use my watch except for occasional notification check and time.

Is that all you can do with it? I use youtube vanced and Spotify free version without the ads ;) so havenot been able to make much use of the normal Spotify that you get in the Galaxy store. 
I think I should have got something with Android OS than the Tizen as I feel it limits me. 

Also I bought it refurbished in Australia and I believe it is a grey import as it says Verizon in lte which is kind of annoying, I couldnot get rid of that even after a factory reset.

Tl:dr How can I make my watch more useful? How to get rid of Lte provider in Grey import?",0,make best use samsung galaxy watch original currently using samsung fe galaxy watxh original earbuds plus usually lot customisation phone found proper way use watch except occasional notification check time use youtube vanced spotify free version without ad havenot able make much use normal spotify get galaxy store think got something android o tizen feel limit also bought refurbished australia believe grey import say verizon lte kind annoying couldnot get rid even factory reset tl dr make watch useful get rid lte provider grey import,540
Ringke band just got delivered for my GW 46mm. I can finally use my smart watch without wishing it looked more like my analog, ,0,ringke band got delivered gw mm finally use smart watch without wishing looked like analog,90
I was so happy that they finally made it available in my region. Sucks to suck I guess..., ,0,happy finally made available region suck suck guess,51
"With the $150 off currently, would it be worth upgrading from gear so frontier to GW3?","I was looking around at the watches and noticed the deals. I've had the frontier since it's initial release and it's held true and works like a champ still. It raises the question, is it worth the upgrade and why?",0,currently would worth upgrading gear frontier gw looking around watch noticed deal frontier since initial release held true work like champ still raise question worth upgrade,174
Could someone show the what the new update looks like for the OG GW?, ,0,could someone show new update look like og gw,45
Is hand wash detection included in this new og gw 5.5 update?,[Title],0,hand wash detection included new og gw update title,51
New update brings plenty of Galaxy Watch 3 features to original Galaxy Watch, ,0,new update brings plenty galaxy watch feature original galaxy watch,67
Why doesnt shows live numbers anymore on screen . ?, ,0,doesnt show live number anymore screen,38
Watch3 45mm x OG Watch 42mm (Size comparison), ,0,watch mm x og watch mm size comparison,38
Pushing notifications to GWA2 on BT re-connect.,"Hey all.
Is there a clever way to have my GWA2 get notifications received on my Galaxy S8 while BT was disconnected?

Thanks!",0,pushing notification gwa bt connect hey clever way gwa get notification received galaxy bt disconnected thanks,110
Galaxy ecosystem 😈, ,0,galaxy ecosystem,16
The All New: Pip-Boy Galaxy!, ,0,new pip boy galaxy,18
Watch 3 t-mobile,So I have a friend who got the new s21 plus and the new galaxy watch 3. On the tmobile network and she's having issues on activating it. She says she can't add to the network. Can anyone help. Thanks,0,watch mobile friend got new plus new galaxy watch tmobile network issue activating say add network anyone help thanks,117
Samsung Galaxy Watch 4 switching from Tizen to WearOS would be a disaster — here’s why, ,0,samsung galaxy watch switching tizen wearos would disaster,58
"Samsung killing Find My Phone ""Locate phone"" from watch. Why?", ,0,samsung killing find phone locate phone watch,45
When you forget to take off your watch whilst spraying ceilings 😔, ,0,forget take watch whilst spraying ceiling,41
How many of you wear your watch while sleeping?,"

[View Poll](https://www.reddit.com/poll/lrwwp2)",0,many wear watch sleeping view poll,34
Gear S2 to Watch 3,"With the $150 off deals, I'm considering whether it is time to upgrade.  Here's by dilemma.  I basically just use my watch to check notifications, track my steps, get basic info on the weather, look at my schedule, and look a the time.  My old Gear S2 Classic does these things, though I have occasional lock-ups that fix themselves after a minute or two.

I honestly don't know if I don't use more watch apps because I don't really need them, because I don't like them, or because my old watch is a bit slow and clunky.

How different does a modern Watch 3 feel from an old Gear S2?  Are they miles apart in performance?",0,gear watch deal considering whether time upgrade dilemma basically use watch check notification track step get basic info weather look schedule look time old gear classic thing though occasional lock ups fix minute two honestly know use watch apps really need like old watch bit slow clunky different modern watch feel old gear mile apart performance,350
Chronograph watch face gone from OG Galaxy Watch,"I upgraded to the S21 Ultra and since then the Chronograph watch face is nowhere to be found. It was a stock watch face, there from the start when I bought it. I can't even manage to find it in the store. What gives? It was my favorite watch face.",0,chronograph watch face gone og galaxy watch upgraded ultra since chronograph watch face nowhere found stock watch face start bought even manage find store give favorite watch face,179
"Hi guys, recently my galaxy watch 3 stopped receiving notifications although it's all turned on. Incoming calls is only notification it's displaying. Anyone knows solution?", ,0,hi guy recently galaxy watch stopped receiving notification although turned incoming call notification displaying anyone know solution,134
Looking for a not very busy Analog Watch Face,"Hi,

I have the original Galaxy Watch. I am looking for recommendations for an analog watch face that is not busy looking. Almost all faces i see tend to have every data available on the face. So far the default one is the only one that meets the needs but I would like a new look.

The things I want on the watch face is weather, battery and date. Bonus if it has a digital time somewhere.

Does anyone have recommendations?",0,looking busy analog watch face hi original galaxy watch looking recommendation analog watch face busy looking almost face see tend every data available face far default one one meet need would like new look thing want watch face weather battery date bonus digital time somewhere anyone recommendation,300
Spotify streaming without wifi,"Everytime I use spotify it automatically turns on my wifi, even when I'm connected to Bluetooth. Is there away to stream music ONLY through Bluetooth and stop it from turning on my wifi.",0,spotify streaming without wifi everytime use spotify automatically turn wifi even connected bluetooth away stream music bluetooth stop turning wifi,147
Will this be rejected for Trade-in?, ,0,rejected trade,14
The new digital health dashboard from GW3, ,0,new digital health dashboard gw,31
Does anyone know how to use ECG on a watch and a phone bought from different countries?,"I've got a s20 from Canada and galaxy watch 3 from South Korea and I cannot use ECG in my devices. I still can download the app, but it is not working. Please help",0,anyone know use ecg watch phone bought different country got canada galaxy watch south korea cannot use ecg device still download app working please help,153
Stainless Steel Band Recommendations for Black Galaxy Watch 42mm?,As the title says I'm looking for a decent stainless steel band for my Galaxy Watch preferably with a deployment style clasp. Thanks!,0,stainless steel band recommendation black galaxy watch mm title say looking decent stainless steel band galaxy watch preferably deployment style clasp thanks,157
Why is there an update for Bixby... every 5 freaking minutes?!,"I rarely use Bixby, but having the ability to control system settings is pretty neat. However everytime I try to use it, it either:
- Doesn't work at all
- loads very slow
- [it prompts for an update](https://knowyourmeme.com/photos/1407493-for-five-minutes)",0,update bixby every freaking minute rarely use bixby ability control system setting pretty neat however everytime try use either work load slow prompt update,156
"My Galaxy combo ( Samsung Galaxy Note 10, Samsung Galaxy buds + and Samsung galaxy watch 3)", ,0,galaxy combo samsung galaxy note samsung galaxy bud samsung galaxy watch,72
Watch Active 2 - Change region help,"First of all thank you for your help and patience folks in advanced! I am a complete noob with this sort of stuff - really appreciate it 

I bought a watch active 2 second hand but didn't know that it was from a region without Samsung pay. I have seen a couple of videos like this [https://www.youtube.com/watch?v=EyaGf31T6Xc](https://www.youtube.com/watch?v=EyaGf31T6Xc) and think I can follow it but need to have the right firmware

&amp;#x200B;

I have the watch active 2 SM-R830 running Tizen [5.5.0.2](https://5.5.0.2) 

&amp;#x200B;

I loved the pay feature on my OG watch active  :(",0,watch active change region help first thank help patience folk advanced complete noob sort stuff really appreciate bought watch active second hand know region without samsung pay seen couple video like think follow need right firmware amp x b watch active sm r running tizen amp x b loved pay feature og watch active,316
Galaxy Watch Vs Galaxy Watch3,"I just the Galaxy Watch though epp for $64, is there any major differences between the watches. Also dose the Galaxy Watch have MST because MST was removed from the s21.",0,galaxy watch v galaxy watch galaxy watch though epp major difference watch also dose galaxy watch mst mst removed,113
HUGE discounts on Galaxy Watch models at Best Buy,"GW 46mm: $279 -&gt; $189

---------------

GW3 41mm BT: $399 -&gt; $249

GW3 41mm LTE: $449 -&gt; $299

---------------

GW3 45mm BT: $429 -&gt; $279

GW3 45mm LTE: $479 -&gt; $329

---------------

GWA 1 40mm: $199 -&gt; $149

---------------

GWA 2 40mm BT: $249 -&gt; $199

GWA 2 40mm LTE: $379 -&gt; $279

---------------

GWA 2 44mm BT: $269 -&gt; $219

GWA 2 44mm LTE: $399 -&gt; $299",0,huge discount galaxy watch model best buy gw mm gt gw mm bt gt gw mm lte gt gw mm bt gt gw mm lte gt gwa mm gt gwa mm bt gt gwa mm lte gt gwa mm bt gt gwa mm lte gt,164
Watch Active 2 query,If the watch is turned off and I turn it on again. Does it send a notification/alert to the connected phone saying its now on???,0,watch active query watch turned turn send notification alert connected phone saying,83
Question about GW3 LTE,"Hi, I'm in Mexico, but I will be moving to Canada soon. There's a sale on GW3 and I was wondering how it works if I get the LTE version from Mexico. Will I be able to use it in Canada? I honestly have no idea how this LTE thing works. 

Thanks.",0,question gw lte hi mexico moving canada soon sale gw wondering work get lte version mexico able use canada honestly idea lte thing work thanks,142
Differences in speaker quality,I'm one of those weird guys who actually uses thier watch as a phone pretty often. Can anyone that has owned an original galaxy watch and a galaxy watch 3 tell me if the speaker is better or worse on one or the other? Thanks!,0,difference speaker quality one weird guy actually us thier watch phone pretty often anyone owned original galaxy watch galaxy watch tell speaker better worse one thanks,168
I hope Samsung is going to release the Notes app for the Watch at some point...,It would be pretty useful. Shopping List etc...,0,hope samsung going release note app watch point would pretty useful shopping list etc,85
Finally upgraded from the stock band on my Active2, ,0,finally upgraded stock band active,34
Still no ECG and oxy in France?,"Anybody have a clue about when these awaited features will be available?

Thanks to all",0,still ecg oxy france anybody clue awaited feature available thanks,66
Coupons stuck on apply infinite spinner. Used to work fine a while ago. Phone: Oneplus, ,0,coupon stuck apply infinite spinner used work fine ago phone oneplus,68
About to pickup an Active 2,"My apologies if this is considered a low content post, I couldn't find a meta 'ask your dumb question here' thread. 

Is there any significant difference between the 42 and 44mm sizes? Do both have the same battery?

Anything else I should consider before buying? What would you do differently if you were to buy a watch today? Anything to consider or look out for considering the strap? Should I immediately get a screen protector?",0,pickup active apology considered low content post find meta ask dumb question thread significant difference mm size battery anything else consider buying would differently buy watch today anything consider look considering strap immediately get screen protector,261
How to sync workouts from shealth to Strava on ios?, ,0,sync workout shealth strava io,30
"Good cover, screen protector and bezel cover for galaxy watch 3",I haven't seen it asked in awhile. I just ordered my galaxy watch 3 and I want to order some protection for it. Has anyone personally bought any of these three things individually or as a set and had a good experience? Appreciate any advice,0,good cover screen protector bezel cover galaxy watch seen asked awhile ordered galaxy watch want order protection anyone personally bought three thing individually set good experience appreciate advice,201
Samsung Active 2 trade in deal UK,"I've been wanting to get an Active 2 for a while and there's a great deal on the Samsung UK store. Discount and wireless charger IMG oad for free. I noticed they were also offering £50 trade in discount for any smart phone. 

I have a really old pebble time smartphone that powers on hold charge but otherwise doesn't really function. (Small print says there's pretty but a flat rate if £25 for phone's not meeting min requirement. The other plan was to buy a £10 new smartwatch from Amazon and send that ending up saving £40 over all. Has anyone done similar or is the trade in more trouble than worth with surcharges.

Also is it worth just going for the watch 3 over the active 2?

Thanks in advance.",0,samsung active trade deal uk wanting get active great deal samsung uk store discount wireless charger img oad free noticed also offering trade discount smart phone really old pebble time smartphone power hold charge otherwise really function small print say pretty flat rate phone meeting min requirement plan buy new smartwatch amazon send ending saving anyone done similar trade trouble worth surcharge also worth going watch active thanks advance,449
How much extra battery drain can I expect on my phone when I connect smartwatch?,"I'm going to get GW3 next week and as I've never had smartwatch before I have a lot of questions but biggest is how will it affect my phone battery?

Also any other tips for new user would be great 😇",0,much extra battery drain expect phone connect smartwatch going get gw next week never smartwatch lot question biggest affect phone battery also tip new user would great,168
"I want a dataplan on my Galaxy Watch 3 LTE, my phone is with Mint Mobile; what are my options?","Like the title says, I'd like to get data with my Galaxy Watch 3 LTE, but my phone carrier does not offer a watch plan.  Are there any companies that offer a standalone watch data only plan?",0,want dataplan galaxy watch lte phone mint mobile option like title say like get data galaxy watch lte phone carrier offer watch plan company offer standalone watch data plan,173
Camera Controller App Unavailable on GW1 / S21U (UK),"Don't know if anyone else has had this issue but despite both my watch and device being [compatible](https://i.imgur.com/Y81HKUl.jpg) with the Camera Controller app, I cannot download it, trying to load the link to the Galaxy Store simply displays [this message.](https://i.imgur.com/l4FSCLV.png) 

For extra details, phone is an S21U (G998BXXU1AUB9) and watch is GW1 (R810XXU1DSL1)",0,camera controller app unavailable gw u uk know anyone else issue despite watch device compatible camera controller app cannot download trying load link galaxy store simply display message extra detail phone u g bxxu aub watch gw r xxu dsl,238
Galaxy Watch 3 (or Active 2) charger disassembly,"Has anyone ever found a good teardown of said charger? I've done some digging around but can't seem to find any. Or, better yet, has anyone done it themselves?

The charger just stopped working one day, so I'm wondering if i might find a fix when I take it apart.",0,galaxy watch active charger disassembly anyone ever found good teardown said charger done digging around seem find better yet anyone done charger stopped working one day wondering might find fix take apart,205
Re-calibrate blood pressure galaxy 2?,"My watch BP measurements are too low and I need to re-calibrate, but I do not see any option to do this again.",0,calibrate blood pressure galaxy watch bp measurement low need calibrate see option,82
Galaxy and IPhone,"Hey guys, I’ve tried to work this out myself but just struggling. Just moved over from a Pixel and just hating how they’re not working together the same. I finally worked out how to block apps from sending notifications, but I’m still getting all notifications when I’m on the iPhone and it’s unlocked and I HATE it. Anyone know how to fix this? Thanks",0,galaxy iphone hey guy tried work struggling moved pixel hating working together finally worked block apps sending notification still getting notification iphone unlocked hate anyone know fix thanks,197
Health monitor for uk, ,0,health monitor uk,17
was bored at the weekend. Hearts are Battery. Hungerbar symbolizes how much i reached my goal., ,0,bored weekend heart battery hungerbar symbolizes much reached goal,66
Any idea what caused these marks to appear and how to get rid of them. I use a Ringke case, ,0,idea caused mark appear get rid use ringke case,47
Galaxy Watch 3 question,"I've been rocking my Galaxy Watch Active 2 ever since it officially released. For my GW3 users out there, do you think the upgrade is worth it? What's you all's experience been like since you've gotten your watch?",0,galaxy watch question rocking galaxy watch active ever since officially released gw user think upgrade worth experience like since gotten watch,143
I have questions about planning to get a Galaxy watch for the first time. Detailed questions in the comments., ,0,question planning get galaxy watch first time detailed question comment,71
eSIM data plan activation problem. Keeps spinning with no QR code scan option., ,0,esim data plan activation problem keep spinning qr code scan option,67
