title,selftext,subreddit,title_text,text_len
The wait is too much!,"Ordered my very 1st apple watch over 2 wks ago. Was supposed to come this Wed. Then, today, as of yesterday it was now coming tomorrow and as of today ... Monday! WTH! Is it always this bad? I would’ve gone to my local apple store but they have horrible customer service, make you wait in line even if you have an appointment and don’t apparently follow any Covid proto. Ugh ... the anticipation is just too much. (Thank you for letting me vent).",1,wait much ordered st apple watch wks ago supposed come wed today yesterday coming tomorrow today monday wth always bad would gone local apple store horrible customer service make wait line even appointment apparently follow covid proto ugh anticipation much thank letting vent,276
"Observation about battery draining, curious if anybody else has experience this?","Hello all,  


I just picked up an SE, and I've noticed something about battery health. Hoping somebody could either corroborate my theory, or tell me if I have a defective device.  


If I charge my watch overnight, it appears that the watch drains somewhat faster. It's currently 10:30 AM and I'm already at 83%.

  
Yesterday and the day before, I charged it over night, went for a run in the morning, then threw it back on the charger for 15-20 mins, which charged it back up to 100%. Yesterday I 10:30, I still have around 95% battery.  


Is there anything to this? When you charge the watch overnight, does it actually stop charging at 100% in the middle of the night and then lose a little juice? By charging it again after my run, did I truly charge it to 100%?   


Let me know if anybody thinks this makes sense lol.",1,observation battery draining curious anybody else experience hello picked se noticed something battery health hoping somebody could either corroborate theory tell defective device charge watch overnight appears watch drain somewhat faster currently already yesterday day charged night went run morning threw back charger min charged back yesterday still around battery anything charge watch overnight actually stop charging middle night lose little juice charging run truly charge let know anybody think make sense lol,518
"In ER and just told I have AFib, then got this...", ,1,er told afib got,16
"Vegan leather loop, red.", ,1,vegan leather loop red,22
I can’t play music on my phone from my watch anymore. Help?,"I used to be able to tell my watch to play a song, and the song would start playing on my phone. But now when I have my watch play music, it asks me to pair a device (my airpods pop up). I really like being able to use my phone as a speaker and control it from my watch, but I’m not sure what happened to make that not work anymore. Any tips?",1,play music phone watch anymore help used able tell watch play song song would start playing phone watch play music asks pair device airpods pop really like able use phone speaker control watch sure happened make work anymore tip,228
"Just got out the shower and put my watch on, says it’s charging. Is it? Maybe to do with the water on my arm or something? Just thought it was cool!", ,1,got shower put watch say charging maybe water arm something thought cool,72
Favourite Apple Watch Edition?,"From the Apple Watch Edition collection*** so like all those top end materials that come with a unique sport band and an extra year of warranty.

Which is your favourite?

[View Poll](https://www.reddit.com/poll/lxj5w9)",1,favourite apple watch edition apple watch edition collection like top end material come unique sport band extra year warranty favourite view poll,145
Got my new Apple Watch series 6 cellular.. Loving it 😍, ,1,got new apple watch series cellular loving,42
I bought a snap on case for my Series 3. But swiping or scrolling doesn’t work.,"It only works with “Wrist detection” turned off. 

Anyone else have this issue? And does it depend on the type of case ie gel or hard plastic/cheap or expensive brand etc? Or do I need to get a newer Watch? 

Thanks!",1,bought snap case series swiping scrolling work work wrist detection turned anyone else issue depend type case ie gel hard plastic cheap expensive brand etc need get newer watch thanks,183
"New apple watch out of the box. Wat is this? Why wont it turn on, was it dead in the box?", ,1,new apple watch box wat wont turn dead box,42
Got my Apple Watch SE yesterday!!! Really like it!!!, ,1,got apple watch se yesterday really like,40
Apple Watch as storage,"apple watch have 8Gb or more storage today and i was i treated , can i store anything on my wrist ? is there any app that can transfer file from iPhone to my applewatch ? any file not oly pdf or text maybe zip archive or others ....  it will be really useful for me ..",1,apple watch storage apple watch gb storage today treated store anything wrist app transfer file iphone applewatch file oly pdf text maybe zip archive others really useful,170
Thanks to apple watch i was finally able to reach the low level of cardio fitness, ,1,thanks apple watch finally able reach low level cardio fitness,62
I’m about to buy an Apple Watch S6 tomorrow...,Is there anything I’m missing? When is the new one rumored to release? Will it have a sexy redesign like the iPad Pro / iPhone 12 Pro Max? Will there be any new features added? What more can we add to this watch that it doesn’t already have / do? Please help 💀,1,buy apple watch tomorrow anything missing new one rumored release sexy redesign like ipad pro iphone pro max new feature added add watch already please help,156
Couple questions...,"I want to get a Apple watch se but unsure about size, I read that both the 40mm and 44mm are actually the same size case but the 44mm just has a more screen? Is that right ? 

Also does one absolutely need an iphone to get a Apple watch ? 

Thanks 🤙👍",1,couple question want get apple watch se unsure size read mm mm actually size case mm screen right also one absolutely need iphone get apple watch thanks,152
Looking for easy removable screen protector for working out,"I have an Apple Watch 6 for a few months now and I'm absolutely in love. Yesterday, I scratched my watch while working out and I noticed some tiny scratches probably caused by my boxing gloves ( I wear my watch on the inside of my arm to protect it). I was wondering if any of you got some tips on easy to click on temporary watch protectors so I don't have to worry about scratching it when working out. The ones on amazon I found look like a pain to remove and I don't want to have a permanent protector",1,looking easy removable screen protector working apple watch month absolutely love yesterday scratched watch working noticed tiny scratch probably caused boxing glove wear watch inside arm protect wondering got tip easy click temporary watch protector worry scratching working one amazon found look like pain remove want permanent protector,339
You can’t beat me 😎, ,1,beat,4
Got a cute little iMac holder for my Apple Watch for the charger., ,1,got cute little imac holder apple watch charger,47
AW6 kills my Bluetooth,"Devices: 
Apple Watch Series 6
iPhone 11 Pro Max
Sony WF-1000XM3 
Latest firmware on all. 

Short story: since I got the AW a couple of weeks ago (my first AW) I noticed that the Bluetooth connection is very unstable with my headphones. Every 20-30s the connection drops for &lt;1s while listening music. And it’s very annoying. 

I disconnected my AW and everything is back to normal. Except that the watch is standalone. Activating BT on watch kills it on headphones. 

Tried resetting the headphones many times. Unpairing. Nothing works. 

Do you know any workaround for this? It’s so bad that I have to use the lightning ones... 

Thanks.",1,aw kill bluetooth device apple watch series iphone pro max sony wf xm latest firmware short story since got aw couple week ago first aw noticed bluetooth connection unstable headphone every connection drop lt listening music annoying disconnected aw everything back normal except watch standalone activating bt watch kill headphone tried resetting headphone many time unpairing nothing work know workaround bad use lightning one thanks,435
New bands day!, ,1,new band day,12
Not sure if the under desk treadmill was a good idea..., ,1,sure desk treadmill good idea,29
What limited Edison awards do you have?, ,1,limited edison award,20
"My apple watch spent 24 hours 19 feet below the surface of Lake Superior, and survived","This is the story of how my apple watch survived frigid and turbulent waters for over 24 hours, and was working when recovered.

My girlfriend and I had taken a trip last summer to the Upper Peninsula of Michigan during the early stages of our relationship to learn more about each other. We had an amazing time, but one of the days we decided to go cliff diving at black rocks in Marquette, Michigan. The drop from black rocks is about 20 feet until you hit the water, and the bottom is 19-22 feet below the surface. In my carelessness i had left my series 4 on my wrist when she and I jumped and had a friend we met there film it. We jumped a few times, then got back to the truck because the lake temp is only in the 50’s on a good day. Once we got to the bar later she noticed my watch was missing, i panicked and after searching the truck we watched the video of our cliff dive and realized it had fallen off.

Fast forward to the next day we went on a kayak trip and somehow the idea got in my head that i could dive down and get it. So about 24 hours later as the sun was setting again we got to black rocks. I borrowed a pair of children’s goggles and jumped in to search. The water there is frigid, about 50’ on the surface and so close to freezing at the bottom the massive boulders feel like slippery ice cubes. I dove down about 5-6 times in the approximate location of where i lost it, but the visibility was terrible in the goggles. I came up after my last dive, to get ready for the next when the guy i borrowed the goggles from offered to switch with me in the search for a bit. For context they say if you stay in lake superior for more than 10 minutes you’ll get hypothermia, at that point i had been in for almost 17 minutes. So we traded places. On the third dive down as my girlfriend was warming me up our new friend came up with a black object in his right hand. He had found the watch! As he brought it up and i fought off the early stages of hypothermia he came walked towards me. For context i had previously offered anyone who found it $50 if it was broken, and $100 if it was working. When he got close to me i asked him if it was working and he replied “well, were you listening to led zeppelin?”. Not only was it working, but it still had a 43% charge from over 48 hours since its last. I was amazed that it survived that long in that deep of water. The guy who found it out of the kindness of his heart refused my money.

To this day i still have that watch, and it still works perfectly fine!

Tl;dr: dropped my watch 19 feet or more down in lake superior and it spent 24 hours down there. Went back for it and found it, and it was still working.

Edit: wow! Didnt expect this post to get so much attention! Trying to reply to all the questions now :)",1,apple watch spent hour foot surface lake superior survived story apple watch survived frigid turbulent water hour working recovered girlfriend taken trip last summer upper peninsula michigan early stage relationship learn amazing time one day decided go cliff diving black rock marquette michigan drop black rock foot hit water bottom foot surface carelessness left series wrist jumped friend met film jumped time got back truck lake temp good day got bar later noticed watch missing panicked searching truck watched video cliff dive realized fallen fast forward next day went kayak trip somehow idea got head could dive get hour later sun setting got black rock borrowed pair child goggles jumped search water frigid surface close freezing bottom massive boulder feel like slippery ice cube dove time approximate location lost visibility terrible goggles came last dive get ready next guy borrowed goggles offered switch search bit context say stay lake superior minute get hypothermia point almost minute traded place third dive girlfriend warming new friend came black object right hand found watch brought fought early stage hypothermia came walked towards context previously offered anyone found broken working got close asked working replied well listening led zeppelin working still charge hour since last amazed survived long deep water guy found kindness heart refused money day still watch still work perfectly fine tl dr dropped watch foot lake superior spent hour went back found still working edit wow didnt expect post get much attention trying reply question,1573
Anyone getting this over everything? This happened as I was taking the trash out., ,1,anyone getting everything happened taking trash,47
What is the app from the middle complication?, ,1,app middle complication,23
"Apple just got approval for the ECG in Australia, software update imminent", ,1,apple got approval ecg australia software update imminent,57
I’m not sure why I didn’t do this sooner, ,1,sure sooner,11
Australia finally gets ECG, ,1,australia finally get ecg,25
Broken screen / is Apple the only place to fix it?,They want to charge 199 to fix my screen. Does anyone know a place where I can get a replacement for cheaper in Los Angeles ?,1,broken screen apple place fix want charge fix screen anyone know place get replacement cheaper los angeles,106
Watch face, ,1,watch face,10
"My Apple Watch charger of four years died back in January a few months ago,couldn’t afford an official Apple Watch charger right now so I ordered this off brand Apple Watch charger off Amazon last week. Definitely as good as the original Apple brand charger,would definitely recommend.", ,1,apple watch charger four year died back january month ago afford official apple watch charger right ordered brand apple watch charger amazon last week definitely good original apple brand charger would definitely recommend,222
How to use 2 apple watches at the same time on 1 iPhone,"My dad has an iPhone, and I have an android, and I want to get the apple watch SE. Is there a way I can use both my apple watch and my dad's at the same time?",1,use apple watch time iphone dad iphone android want get apple watch se way use apple watch dad time,99
"Can’t use Nike training club app , it just shows this .", ,1,use nike training club app show,31
Did I get given a correct repair quote? [UK],"I have a 40mm S6 watch. I dropped it and the screen got a massive scrape, as well as the casing surrounding the screen getting many scratches that exposed the unpainted metal. 

As it was so new, I decided to see how much it would cost to repair. Contacted Apple support and used their live chat option. I got a very helpful advisor who advised me that the price would be £286.44. Steep but fair enough since I don’t have AppleCare+. I lost connection near the end so I got an email through with a link to pay to complete the repair request. 

However, it said I had to pay £386.44, not £286.44. I assumed this was a typo so got back on to live chat and explained the issue. I was told that I was quoted the incorrect price by the first advisor and that £286.44 was only for a screen replacement, that the casing is extra and then tax on top of that. 

I immediately balked at this as I paid £329 for the watch brand new. I declined to go forward for the repair as it was illogical - I could just buy a new watch and save money. 

My question is, was the second advisor correct? I had a look at the pricing list on apple’s website and I couldn’t see anything that meant adding to the £286.44 - it seems to be a flat fee? But I may have missed something.",1,get given correct repair quote uk mm watch dropped screen got massive scrape well casing surrounding screen getting many scratch exposed unpainted metal new decided see much would cost repair contacted apple support used live chat option got helpful advisor advised price would steep fair enough since applecare lost connection near end got email link pay complete repair request however said pay assumed typo got back live chat explained issue told quoted incorrect price first advisor screen replacement casing extra tax top immediately balked paid watch brand new declined go forward repair illogical could buy new watch save money question second advisor correct look pricing list apple website see anything meant adding seems flat fee may missed something,760
"So this has been happening with my stainless steel series 5 watch pretty much from day 1. Not very noticeable in daylight, however in darker light it looks pretty bad. Sent my watch off to be looked at, apparently no issues have been detected. Is this normal or I should push that it’s a fault?", ,1,happening stainless steel series watch pretty much day noticeable daylight however darker light look pretty bad sent watch looked apparently issue detected normal push fault,173
Asking my cat a question and Siri thought I was talking to her...., ,1,asking cat question siri thought talking,40
Second hand fades after a few seconds? How to extend time it shows?,"I hope I’m describing the situation correctly.....I want to see the second hand on my watch while I’m looking at it but sometimes it fades after maybe 5 seconds. Other times it stays. I hate having to flick my wrist (really I have to lower my arm, flick, bring it back to view, flick again, etc). I need to time short periods of time, like a minute to two minutes. How do I get the second hand to not fade away? I’ve checked my settings and I can’t seem to figure it out. I’m using one of the pride faces if that makes a difference.

There must be some trick with position or movement m not understanding. Any help?

Ty!",1,second hand fade second extend time show hope describing situation correctly want see second hand watch looking sometimes fade maybe second time stay hate flick wrist really lower arm flick bring back view flick etc need time short period time like minute two minute get second hand fade away checked setting seem figure using one pride face make difference must trick position movement understanding help ty,408
40mm vs 44mm Size,Purchased the 40mm series 6 a couple of months ago and really like it. I find myself wishing I had of gone for the 44mm model instead as the 40mm looks quite small on my wrist. Is there trade in or upgrade options available that anybody knows of. Australian here. Cheers,1,mm v mm size purchased mm series couple month ago really like find wishing gone mm model instead mm look quite small wrist trade upgrade option available anybody know australian cheer,183
Has anyone reassessed their watch collecting after getting an Apple Watch?,Not sure whether to post here or r/watches so I’ll try here first. I was all ready to buy a Tudor Black Bay next month. I’ve wanted one for a couple of years and next month I should be able to buy one. But I got an Apple Watch for Christmas and I haven’t worn anything else since lol. I’m seriously starting to wonder  if I should pull the trigger on the BB and just have it sat in its box.,1,anyone reassessed watch collecting getting apple watch sure whether post r watch try first ready buy tudor black bay next month wanted one couple year next month able buy one got apple watch christmas worn anything else since lol seriously starting wonder pull trigger bb sat box,279
Scratched screen series 6 DAYS OLD,"Just switched ecosystems from Android to iOS and picked up a series 6 watch. I ordered some screen protectors from Amazon but while waiting for them i noticed that screen already had a good amount of scratches on it already, (expensive sigh) anybody else notice how fragile the screens are?? I’m not out rock climbing, nor am I out running the streets. I don’t wear anything else on that wrist but my sleeves do cover it (cue apple blaming me for wearing my clothes wrong.. jkjk).. just looking for advice or something..",1,scratched screen series day old switched ecosystem android io picked series watch ordered screen protector amazon waiting noticed screen already good amount scratch already expensive sigh anybody else notice fragile screen rock climbing running street wear anything else wrist sleeve cover cue apple blaming wearing clothes wrong jkjk looking advice something,359
All Black Never Goes Wrong., ,1,black never go wrong,20
"The frequency of “how do you get that watch face” comments in this sub baffles me. No hate, just sharing an honest impression.","True, there might be some small details anyone can find out by looking at other people’s watch faces... and sure, there’s nothing wrong with asking but It looks to me like a lot of people barely know their watches!",1,frequency get watch face comment sub baffle hate sharing honest impression true might small detail anyone find looking people watch face sure nothing wrong asking look like lot people barely know watch,201
Suddenly losing its charge quickly,Today was the first time on my S5 that I noticed it lost its charge super quick. 15% by 4 pm and normally that doesn’t happen until 9 or 10 pm. What gives?,1,suddenly losing charge quickly today first time noticed lost charge super quick pm normally happen pm give,106
Watch and iPhone not syncing?,"I’m using a Series 5 on WatchOS 7.3.1 and an iPhone 11 Pro on iOS 14.4. 

When I read a message on my iPhone, it’s marked read on my watch. When I read a message on my watch, it’s marked as read on my phone. When I delete a message from my iPhone, it does NOT delete on my watch. When delete a message on my watch, it does NOT delete on my iPhone. 

What gives? This is getting as annoying as iCloud mail not syncing between my iPhone and iPad.",1,watch iphone syncing using series watchos iphone pro io read message iphone marked read watch read message watch marked read phone delete message iphone delete watch delete message watch delete iphone give getting annoying icloud mail syncing iphone ipad,254
3rd Party Braided Solo Loops?,"Not fancying the idea of spending $129 CAD for a watch band but if there’s no good 3rd party ones than i might have to if i want to play. 

Most are fake and rubber with the look and style of braided. 

Is there actual good, real braided solo loops out there?",1,rd party braided solo loop fancying idea spending cad watch band good rd party one might want play fake rubber look style braided actual good real braided solo loop,164
March Challenge,I am curious to know what your March Challenge distance is. Mine is 95.6 miles. Was concerned a bit at first but think it will be quite manageable.,1,march challenge curious know march challenge distance mine mile concerned bit first think quite manageable,106
Cracked Screen - Too late for Apple care?,"So, question about Apple Care. My daughter bought an Apple Watch with Christmas money and before we even had a chance to get Apple Care she cracked the screen. Long story short, I contacted Apple to find out what it would cost to replace screen, and of course it was more than the watch retail. So now I’m stuck with this watch and not sure what to do. My question is this; Apple asked me for serial number on watch when we got the quote, is it too late now to grab Apple care and replace it? Or is that serial number flagged now?",1,cracked screen late apple care question apple care daughter bought apple watch christmas money even chance get apple care cracked screen long story short contacted apple find would cost replace screen course watch retail stuck watch sure question apple asked serial number watch got quote late grab apple care replace serial number flagged,339
finally got to arranging my apps in some way, ,1,finally got arranging apps way,30
Standby locked screen,"Hi, Thank You for your time to read my message &amp; potentially respond.  

I have to Apple Watch 5 and am having troubles with 1 of my Apple Watches locking on its own while it’s in use.  

For health reasons, unless I’m in the shower, I always wear an Apple Watch, which is why I have 2.  

I’ve done research on my issue &amp; cannot find a resolution.    

Basically during the day/night, while I’m wearing the watch, it will lock on its own.  

I have cleaned the sensors and it did not correct the issue.  

I have the most recent software on it &amp; it’s not jail broken.  

I have even gone as far as resetting the watch, removing it from the iCloud &amp; connected it as a brand new watch (did not do the restore option) and the issue was not resolved.  

Short of contacting Apple, I do not know what else to do.  

Could it be due to me having the watch band to tight? 

I do not have a rash, or any cuts, bruises, redness where I wear the watch.  

I do have arm hair there.  

Does anyone have any recommendations how to resolve this issue? 

**I apologize if this is confusing, my ADD/ADHD is causing me issues today.**

Again, Thank You for your time.  

Stay safe &amp; have a wonderful day.",1,standby locked screen hi thank time read message amp potentially respond apple watch trouble apple watch locking use health reason unless shower always wear apple watch done research issue amp cannot find resolution basically day night wearing watch lock cleaned sensor correct issue recent software amp jail broken even gone far resetting watch removing icloud amp connected brand new watch restore option issue resolved short contacting apple know else could due watch band tight rash cut bruise redness wear watch arm hair anyone recommendation resolve issue apologize confusing add adhd causing issue today thank time stay safe amp wonderful day,649
